id,title,duration,mpa,rating,votes,méta_score,description,movie_link,writers,directors,stars,budget,opening_weekend_gross,gross_worldwide,gross_us_canada,release_date,countries_origin,filming_locations,production_companies,awards_content,genres,languages
tt0111248,South Beach Academy,1h 31m,R,3.7,704,,"What do you do when the future of your school, your family, and your fortune all rest on the performance of the school's all-female volleyball team? It's up to two brothers and a steamy student body to save the day.",https://www.imdb.com/title/tt0111248/,['Bill Milling'],['Joe Esposito'],"['Keith Coulouris', 'Elizabeth Kaitan', 'Corey Feldman', 'Al Lewis', 'James Hong', 'Lorelei Leslie', 'Julie Cialini', 'Marcus Mueller', 'Amy Lynn Rosenthal', 'Ute Weigel']",,,,,24-09-1996,['United States'],"['Broward County, Florida, USA']",['Future Films'],,['Comedy'],['English']
tt0039504,Ivy,1h 39m,Approved,7,1.2K,,"An Edwardian belle meets a rich bachelor, but what to do about her husband and her lover?",https://www.imdb.com/title/tt0039504/,"['Charles Bennett', 'Marie Belloc Lowndes']",['Sam Wood'],"['Joan Fontaine', 'Patric Knowles', 'Herbert Marshall', 'Richard Ney', 'Cedric Hardwicke', 'Lucile Watson', 'Sara Allgood', 'Henry Stephenson', 'Rosalind Ivan', 'Lilian Fontaine']",,,,,03-09-1947,['United States'],"['Universal Studios - 100 Universal City Plaza, Universal City, California, USA (Studio)']",['Interwood Productions'],,"['Crime', 'Drama', 'Thriller']",['English']
tt7681824,We the Animals,1h 34m,R,6.9,4.7K,80,"Manny, Joel, and Jonah tear their way through childhood and push against the volatile love of their parents. As Manny and Joel grow into versions of their father and Ma dreams of escape, Jonah embraces an imagined world all on his own.",https://www.imdb.com/title/tt7681824/,"['Justin Torres', 'Daniel Kitrosser', 'Jeremiah Zagar']",['Jeremiah Zagar'],"['Evan Rosado', 'Raúl Castillo', 'Sheila Vand', 'Isaiah Kristian', 'Josiah Gabriel Santiago', 'Giovanni Pacciarelli', 'Moe Isaac', 'Michael Pemberton', 'Amelia Campbell', 'Mickey Anthony']",,"$63,357","$434,743","$400,961",17-08-2018,['United States'],,"['Cinereach', 'Public Record']",,['Drama'],['English']
tt0316188,Raising Victor Vargas,1h 28m,R,7.2,5.8K,83,"A Lower East Side teen-ager struggles to find some sanity while surrounded by an eccentric grandmother, a crazy new girlfriend, and a longing younger brother.",https://www.imdb.com/title/tt0316188/,"['Peter Sollett', 'Eva Vives']",['Peter Sollett'],"['Victor Rasuk', 'Donna Maldonado', 'Kevin Rivera', 'Krystal Rodriguez', 'Judy Marte', 'Melonie Diaz', 'Matthew Roberts', 'Alexander Garcia', 'John Ramos', 'Theresa Martinez']","$800,000 (estimated)","$33,166","$2,816,116","$2,078,661",02-05-2003,"['France', 'United States']","['Lower East Side, Manhattan, New York City, New York, USA']","['Canal+', 'Forensic Films', 'StudioCanal']",,"['Drama', 'Romance']","['English', 'Spanish']"
tt0071521,Freebie and the Bean,1h 53m,R,6.6,3.8K,,"Two reckless San Francisco police detectives finally obtain evidence against a local crime boss, and while waiting for a witness to arrive before making an arrest, they have to discreetly guard his life against an assassination attempt.",https://www.imdb.com/title/tt0071521/,"['Robert Kaufman', 'Floyd Mutrux']",['Richard Rush'],"['Alan Arkin', 'James Caan', 'Loretta Swit', 'Jack Kruschen', 'Mike Kellin', 'Paul Koslo', 'Linda Marsh', 'John Garwood', 'Alex Rocco', 'Valerie Harper']","$3,000,000 (estimated)",,,,25-12-1974,['United States'],"['Candlestick Park - 602 Jamestown Avenue, San Francisco, California, USA']",['Warner Bros.'],,"['Buddy Comedy', 'Buddy Cop', 'Dark Comedy', 'Satire', 'Action', 'Comedy', 'Crime', 'Drama']","['English', 'Spanish']"
tt0059792,Planet of the Vampires,1h 28m,Not Rated,6.2,7.6K,,"After landing on a mysterious planet, a team of astronauts begin to turn on each other, swayed by the uncertain influence of the planet and its strange inhabitants.",https://www.imdb.com/title/tt0059792/,"['Renato Pestriniero', 'Ib Melchior', 'Alberto Bevilacqua']",['Mario Bava'],"['Barry Sullivan', 'Norma Bengell', 'Ángel Aranda', 'Evi Marandi', 'Franco Andrei', 'Federico Boido', 'Stelio Candelli', 'Alberto Cevenini', 'Mario Morales', 'Ivan Rassimov']","$200,000 (estimated)",,,,27-10-1965,"['Italy', 'Spain']","['Cinecittà Studios, Cinecittà, Rome, Lazio, Italy (Studio)']","['Italian International Film', 'Castilla Cooperativa Cinematográfica']",,"['Space Sci-Fi', 'Vampire Horror', 'Action', 'Adventure', 'Horror', 'Sci-Fi']","['Italian', 'English']"
tt28308341,Radical Wolfe,1h 16m,,7.2,326,65,"With a distinctive style all his own, author and journalist Tom Wolfe reshapes how American stories are told.",https://www.imdb.com/title/tt28308341/,['Michael Lewis'],['Richard Dewey'],"['Christopher Buckley', 'Niall Ferguson', 'Jon Hamm', 'Tom Junod', 'Michael Lewis', 'Lynn Nesbit', 'Gail Sheehy', 'Gay Talese', 'Emily Witt', 'Tom Wolfe']",$1 (estimated),"$7,923","$39,623","$39,623",31-10-2023,['United States'],,,,['Documentary'],['English']
tt0183572,Nessa no chikai (Zenpen; Kôhen),,,5.4,11,,,https://www.imdb.com/title/tt0183572/,"['Kazuo Hasegawa', 'Ureo Egawa', 'Isamu Etô']",['Kunio Watanabe'],"['Kazuo Hasegawa', 'Ureo Egawa', 'Isamu Etô', 'Susumu Fujita', 'Taizô Fukami', 'Kyôzô Fuyuki', 'Koji Hara', 'Seishirô Hara', 'Feng Hua', 'Heikurô Imanari']",,,,,25-12-1940,['Japan'],,,,,['Japanese']
tt0031045,Angels Wash Their Faces,1h 26m,Approved,6,606,,"A former inmate tries to start anew but gets entangled with mobsters and crooked officials, leading to his false accusation of arson and homicide. His struggle to clear his name and break free from the criminal underworld unfolds.",https://www.imdb.com/title/tt0031045/,"['Michael Fessier', 'Niven Busch', 'Robert Buckner']",['Ray Enright'],"['Ann Sheridan', 'Billy Halop', 'Bernard Punsly', 'Leo Gorcey', 'Huntz Hall', 'Gabriel Dell', 'Bobby Jordan', 'Ronald Reagan', 'Bonita Granville', 'Frankie Thomas']",,,,,26-08-1939,['United States'],"['Warner Brothers Burbank Studios - 4000 Warner Boulevard, Burbank, California, USA (Studio)']",['Warner Bros.'],,"['Drama', 'Romance']",['English']
tt4507018,Kachha Yauvan,1h 36m,Not Rated,,,,,https://www.imdb.com/title/tt4507018/,"['Lakshmi Musari', 'Sarika Salunkhe', 'Joe Simpson']",['Jai Simha Musari'],"['Lakshmi Musari', 'Sarika Salunkhe', 'Joe Simpson']",,,,,01-01-1993,['India'],,,,['Thriller'],['Hindi']
tt0041270,Four Against the World,1h 40m,,7.3,33,,"This acclaimed crime-drama by Director Alejandro Galindo, (and co-directed by actor Jose Pulido, also one of this film's stars), is considered the prototypical example of ""Cine Negra Mexicano, otherwise known as Mexican Film Noir, with a unique shadowy, black and white focus on its usual subjects-namely gangsters, cops, and good-girls-gone-bad. It tells the story of four gangsters who successfully ambush and rob a money transport vehicle, but not without killing its occupants in the process. After eluding the police, the quartet must hide out in the attic of a home belonging to one of their co-conspirator's mistresses. Their escape plans, nerves and fellowship all start to fracture, as the four must lie low in hot, cramped and dank conditions. Restored versions of Cuatro Contra el Mundo were featured at both the 65th Berlin International Film Festival in 2015, and the 12th annual FICM Mexican Cine Negra series, in collaboration with the Film Library of UNAM, Televisa Foundation, and the Nationale Cinematheque.",https://www.imdb.com/title/tt0041270/,"['Alejandro Galindo', 'Gunther Gerszo']",['Alejandro Galindo'],"['Víctor Parra', 'Leticia Palma', 'Tito Junco', 'José Pulido', 'Manuel Dondé', 'Conchita Gentil Arcos', 'Salvador Quiroz', 'Sara Montes', 'José Elías Moreno', 'Bruno Márquez']",,,,,06-04-1950,['Mexico'],['Mexico'],['Producciones Azteca'],,"['Crime', 'Drama', 'Thriller']",['Spanish']
tt0128909,Aaram,,,7,61,,"Leela attracts painter Shyam, prince Kumar, and hoodlum Bhagwan. Shyam cons people. Rani Sita introduces Kumar to Leela; he loves her. Kumar and Sita help Shyam win Leela. Bhagwan kidnaps Leela, refuses ransom, wants her for himself.",https://www.imdb.com/title/tt0128909/,"['Dev Anand', 'Madhubala', 'Talat Mahmood']",['D.D. Kashyap'],"['Dev Anand', 'Madhubala', 'Talat Mahmood', 'Premnath Malhotra', 'Durga Khote', 'Manmohan Krishna', 'Ramayan Tiwari', 'Hiralal', 'Tabassum Govil', 'Leela Mishra']",,,,,01-01-1951,['India'],,['Kashyap Productions'],,['Romance'],['Hindi']
tt0054618,Alye parusa,1h 28m,,7,729,,"A little girl Assol met a wizard and it has been foretold: ""... it will be a fine sunny day when a beautiful ship under scarlet sail comes and the noble prince will take you away from here. He'll take you to the world of your dreams, where you will be loved and happy."" The neighbours told jokes about her, children teased her, but she waited for her prince. She trusted in the miracles and waited. Arthur Gray's rule was ""if you can make a miracle, do it!"". And he made a miracle for the wonderful romantic girl.",https://www.imdb.com/title/tt0054618/,"['Alexander Grin', 'Aleksei Nagornyj', 'Aleksandr Yurovsky']",['Aleksandr Ptushko'],"['Anastasiya Vertinskaya', 'Vasiliy Lanovoy', 'Yelena Cheremshanova', 'Aleksandr Lupenko', 'Ivan Pereverzev', 'Sergey Martinson', 'Nikolay Volkov', 'Sergei Romodanov', 'Oleg Anofriev', 'Pavel Volkov']",,,,,07-06-1961,['Soviet Union'],"['Yalta, Crimea, Ukraine']",['Mosfilm'],,"['Drama', 'Fantasy', 'Romance']",['Russian']
tt0379502,Ram Bhakta Hanuman,,,7,22,,"Lankeshwar Ravan abducts Devi Maa Sita from Panchvati during their 14-year exile, defeating Jatayu, who lives long enough to inform Sita's husband, Bhagwan Shri Ram, and his brother, Lakshman, that Sitaji has been forcibly taken in the Southern direction in Ravanji's flying chariot. Shri Ramji enlists the help of Bhagwan Shri Hanuman initially by slaying his brother, Bali, who had dethroned Sugreev and abducted his wife. The search then commences for Sitaji with Hanumanji leaping across the seas to Lanka, killing Ravan's son, Akshaye, and passing on Ramji's message to Sitaji, who is being held in the Ashok Vatica and refuses to give in to Ravan's demands as she is fully aware that he is cursed and will be torn in seven pieces if he dares to molest any woman against her wish. After being captured by Ravan's son, Meghnath, Hanuman does escape, but not before setting Lanka afire with his tail. Ramji, along with an army of apes and bears, descends upon Lanka, kills Ravan's brother, Khumbakaran; while Hanumanji resurrects Lakshman, who was fatally wounded by Meghnath. Lakshman eventually kills Meghnath, while Ramji, with the help of Ravan's brother, Vibhishan, kills 10-headed Ravan. After letting Sitaji sit on a fire-lit pyre to ensure her purification, they return triumphantly to Ayodhaya where Ramji is crowned king. Watch what happens when Hanumanji knowingly insults Sitaji and the impact this has on Ramji and his Darbar.",https://www.imdb.com/title/tt0379502/,"['Trilok Kapoor', 'Sona Chatterjee', 'Amarnath']",['Homi Wadia'],"['Trilok Kapoor', 'Sona Chatterjee', 'Amarnath', 'Shree Bhagwan', 'Dalpat', 'Prabhash Joshi', 'Kamal Kumar', 'Leela Kumari', 'Kanchan Mura', 'Patel']",,,,,01-01-1948,['India'],,['Basant Pictures'],,"['Action', 'Adventure', 'Fantasy', 'History']",['Hindi']
033519,Dead Men Tell,1h 1m,Approved,6.9,1.4K,,"A treasure map in four pieces, the ghost of a hanged pirate, a talking parrot, and a ship full of red herrings complicate Charlie's search for a murderer on board a docked ship.",https://www.imdb.com/title/tt0033519/,"['John Francis Larkin', 'Earl Derr Biggers']",['Harry Lachman'],"['Sidney Toler', 'Sheila Ryan', 'Robert Weldon', 'Victor Sen Yung', 'Donald Douglas', 'Kay Aldridge', 'Paul McGrath', 'George Reeves', 'Truman Bradley', 'Ethel Griffies']",,,,,28-03-1941,['United States'],"['20th Century Fox Studios - 10201 Pico Blvd., Century City, Los Angeles, California, USA (Studio)']",['Twentieth Century Fox'],,"['Crime', 'Mystery']",['English']
tt0011874,A Woman in Grey,3h 55m,,6.7,63,,"After the murder of Mrs. Haynes, resident of the old Armory homestead, there is an ever increasing intensity of the struggle for possession of the Amory code, in which lies the secret of the Amory fortune.",https://www.imdb.com/title/tt0011874/,"['Walter R. Hall', 'A.M. Williamson', 'C.N. Williamson']",['James Vincent'],"['Arline Pretty', 'Henry G. Sell', 'Fred C. Jones', 'John Heenan', 'Margaret Fielding', 'Ann Brody', 'Jane Mair', 'Jack Newton', 'J.W. Driscoll', 'Jack Manning']",,,,,22-01-1920,['United States'],"['Wilkes-Barre, Pennsylvania, USA']",['Serico Producing Company Inc.'],,['Drama'],"['None', 'English']"
tt0024075,Goodbye Again,1h 6m,Unrated,6.3,666,,Flirtatious mix-ups abound when a celebrated novelist tangles with an old flame and her befuddled husband in Cleveland. Will his savvy secretary save his neck if she is secretly in love with him also?,https://www.imdb.com/title/tt0024075/,"['George Haight', 'Allan Scott', 'Ben Markson']",['Michael Curtiz'],"['Warren William', 'Joan Blondell', 'Genevieve Tobin', 'Hugh Herbert', 'Wallace Ford', 'Helen Chandler', 'Hobart Cavanaugh', 'Ray Cooke', 'Jay Ward', 'Ruth Donnelly']",,,,,09-09-1933,['United States'],"['Warner Brothers Burbank Studios - 4000 Warner Boulevard, Burbank, California, USA (Studio)']",['First National Pictures'],,"['Farce', 'Comedy', 'Romance']",['English']
tt0015460,Violettes impériales,2h,,4.3,27,,,https://www.imdb.com/title/tt0015460/,['Henry Roussel'],['Henry Roussel'],"['Raquel Meller', 'Suzanne Bianchetti', 'André Roanne', 'Jeanne Even', ""Jimmy O'Kelly"", 'Claude France', 'Roger San Juana', 'Robert Guilbert', 'Sylviane de Castillo', 'Mademoiselle Farnèse']",,,,,03-02-1924,['France'],"['Sevilla, Andalucía, Spain']",['Productions Henry Roussell'],,"['Adventure', 'Comedy']",['None']
tt0469062,Danika,1h 19m,R,5.5,4K,,Danika's fears for her children are manifested in premonitions of death and disaster.,https://www.imdb.com/title/tt0469062/,['Joshua Leibner'],['Ariel Vromen'],"['Marisa Tomei', 'Hannah Marks', 'Guy Camilleri', 'Akuyoe Graham', 'Ori Pfeffer', 'Jeffrey Nicholas Brown', 'Craig Bierko', 'Kyle Gallner', 'Nicki Prian', 'Ridge Canipe']","$5,000,000 (estimated)",,,,10-06-2005,['United States'],"['Baltimore, Maryland, USA (cheapfrill)']","['Blue Omega Entertainment', 'Danika LLC', 'Roberts/David Films']",,"['Drama', 'Horror', 'Mystery', 'Thriller']",['English']
tt0070655,The House That Vanished,1h 36m,R,5,686,,A young model and her petty thief boyfriend find their way through the English fog to a backwoods manor in hopes of looting it. What they find instead is murder.,https://www.imdb.com/title/tt0070655/,['Derek Ford'],['José Ramón Larraz'],"['Andrea Allan', 'Karl Lanchbury', 'Maggie Walker', 'Peter Forbes-Robertson', 'Judy Matheson', 'Annabella Wood', 'Alex Leppard', 'Lawrence Keane', 'Edmund Pegge', 'Daphne Lea']",,,,,03-10-1974,"['United Kingdom', 'Spain']","['Essex, England, UK']","['Blackwater Film Productions Ltd.', 'Hallmark Channel']",,"['Crime', 'Horror']",['English']
tt0026133,Branded a Coward,58m,Approved,5.5,137,,"Johnny Hume witnesses the slaughter of his family at age six. When he grows into manhood, will he be able to seek his vengeance?",https://www.imdb.com/title/tt0026133/,"['Richard Martinsen', 'Earle Snell']",['Sam Newfield'],"['Johnny Mack Brown', 'Billie Seward', 'Syd Saylor', 'Lloyd Ingraham', 'Lee Shumway', 'Roger Williams', 'Frank McCarroll', 'Yakima Canutt', 'Mickey Rentschler', 'Rex Downing']",,,,,01-07-1935,['United States'],"['Kern River, California, USA']",['Supreme Pictures'],,"['Drama', 'Western']",['English']
tt0158136,The Radio Detective,3h 18m,Passed,6.1,28,,,https://www.imdb.com/title/tt0158136/,"['Arthur B. Reeve', 'Carl Krusada']","['William James Craft', 'William A. Crinley']","['Jack Dougherty', 'Margaret Quimby', 'Jack Mower', 'Wallace Baldwin', 'Howard Enstedt', 'John T. Prince', 'Florence Allen', 'Sammy Gervon', 'Buck Connors', 'George Williams']",,,,,25-04-1926,['United States'],,['Universal Pictures'],,"['Action', 'Adventure', 'Mystery', 'Romance', 'Sport', 'Thriller']",['English']
tt0169615,Birth of a Baby,1h 12m,,3.8,9,,,https://www.imdb.com/title/tt0169615/,"['Arthur L. Jarrett', 'Burk Symon']",['Al Christie'],"['Eleanore King', 'Richard Gordon', 'Ruth Matteson', 'Josephine Dunn', 'William Post Jr.', 'Frederica Going', 'Helen Hawley', 'Kathleen Comegys', 'Robert Ober', 'Edith Gresham']","$43,000 (estimated)",,,,28-09-1938,['United States'],,"['American Committee on Maternal Welfare Inc.', 'Special Pictures Corporation']",,"['Docudrama', 'Drama']",['English']
tt31456973,Alarum,1h 35m,R,3.3,2.2K,23,"Two rogue spies go off-grid, marry, and come under attack at their remote cabin hideaway by various intel agencies seeking a stolen hard drive.",https://www.imdb.com/title/tt31456973/,['Alexander Vesha'],['Michael Polish'],"['Scott Eastwood', 'Sylvester Stallone', 'Willa Fitzgerald', 'Mike Colter', 'D.W. Moffett', 'Isis Valverde', 'Joel Cohen', 'Mark Polish', 'Abigail Spear', 'Anton Narinskiy']","$20,000,000 (estimated)",,"$189,036",,16-01-2025,['United States'],"['Oxford, Ohio, USA']","['BondIt Media Capital', 'Convergence Entertainment Group', 'Grindstone Entertainment Group']",,"['Action', 'Crime', 'Thriller']",['English']
tt1932767,What Maisie Knew,1h 39m,R,7.4,29K,74,"In New York City, a young girl is caught in the middle of her parents' bitter custody battle.",https://www.imdb.com/title/tt1932767/,"['Nancy Doyne', 'Carroll Cartwright', 'Henry James']","['Scott McGehee', 'David Siegel']","['Julianne Moore', 'Alexander Skarsgård', 'Steve Coogan', 'Joanna Vanderham', 'Onata Aprile', 'Sadie Rae', 'Jesse Stone Spadaccini', 'Diana García', 'Amelia Campbell', 'Maddie Corman']","$6,000,000 (estimated)","$21,480","$2,711,379","$1,066,471",03-05-2013,['United States'],"['The High Line, Manhattan, New York City, New York, USA (Maisie and Lincoln play at the High Line)']","['Red Crown Productions', 'Weinstock Productions', '10th Hole Productions']",,['Drama'],['English']
tt0048593,The Sea Chase,1h 57m,Approved,6.4,3.5K,,"As World War II begins, German freighter Captain Karl Ehrlich tries to get his ship back to Germany through a gauntlet of Allied warships.",https://www.imdb.com/title/tt0048593/,"['James Warner Bellah', 'John Twist', 'Andrew Geer']",['John Farrow'],"['John Wayne', 'Lana Turner', 'David Farrar', 'Lyle Bettger', 'Tab Hunter', 'James Arness', 'Richard Davalos', 'John Qualen', 'Paul Fix', 'Lowell Gilmore']",,,,,04-06-1955,['United States'],"['Hawaii, USA (scenes of the ship at sea and on the island)']",['Warner Bros.'],,"['Action', 'Drama', 'War']","['English', 'German']"
tt0036311,Rhythm of the Islands,1h,Approved,5,42,,"On the only Pacific island untouched by and unaware of World-War-Two, American beachcombers Tommy (Allan Jones) and Eddie Dolan (Andy Devine) sell off Paradise Island to American millionaire Holton (Ernest Truex) who has a daughter, Joan (Jane Frazee), ready to fall in love with Tommy. None of this sets too well with the island natives.",https://www.imdb.com/title/tt0036311/,"['Oscar Brodney', 'M.M. Musselman']",['Roy William Neill'],"['Allan Jones', 'Jane Frazee', 'Andy Devine', 'Ernest Truex', 'Marjorie Gateson', 'Mary Wickes', 'Acquanetta', 'Nestor Paiva', 'John Maxwell', 'Maceo Anderson']",,,,,16-04-1943,['United States'],"['Universal Studios - 100 Universal City Plaza, Universal City, California, USA (Studio)']",['Universal Pictures'],,"['Adventure', 'Comedy', 'Music', 'Romance']",['English']
tt0027807,It Couldn't Have Happened (But It Did),1h 10m,Approved,6,162,,"When a play's two producers are murdered, the playwright tries to solve the crime.",https://www.imdb.com/title/tt0027807/,['Arthur T. Horman'],['Phil Rosen'],"['Reginald Denny', 'Evelyn Brent', 'Jack La Rue', 'Inez Courtney', 'Hugh Marlowe', 'Claude King', 'Bryant Washburn', 'Robert Homans', 'Crauford Kent', 'Robert Frazer']",,,,,01-08-1936,['United States'],"['Mayan Theater - 1038 Hill Street, Downtown, Los Angeles, California, USA']",['Invincible Pictures Corp.'],,"['Whodunnit', 'Comedy', 'Crime', 'Mystery', 'Romance']",['English']
tt3790720,Peggy Guggenheim: Art Addict,1h 36m,Not Rated,7.2,889,68,A portrait of a patron of the arts extraordinaire who transformed a modest fortune and impeccable taste into one of the premiere collections of twentieth century art.,https://www.imdb.com/title/tt3790720/,"['Bernadine Colish', 'Lisa Immordino Vreeland']",['Lisa Immordino Vreeland'],"['Peggy Guggenheim', 'Jacqueline Bograd Weld', 'Francine Prose', 'John Richardson', 'Nicky Haslam', 'Edmund White', 'Calvin Tomkins', 'Carlo McCormick', 'Mercedes Ruehl', 'Diego Cortez']","$1,100,000 (estimated)","$22,258","$796,800","$498,428",11-12-2015,['United States'],,"['Dakota Group', 'Fischio Films', 'Submarine Entertainment']",,"['Biography', 'Documentary', 'History']",['English']
tt0040978,Yellow Sky,1h 38m,Approved,7.4,6K,,A pistol-packing tomboy and her grandfather discover a band of bank robbing bandits taking refuge in the neighboring ghost town.,https://www.imdb.com/title/tt0040978/,"['Lamar Trotti', 'W.R. Burnett', 'Jacques Monteux']",['William A. Wellman'],"['Gregory Peck', 'Anne Baxter', 'Richard Widmark', 'Robert Arthur', 'John Russell', 'Harry Morgan', 'James Barton', 'Charles Kemper', 'Carlos Acosta', 'Robert Adler']",,,,"$5,600,000",24-12-1948,['United States'],"['Death Valley National Park, California, USA']",['Twentieth Century Fox'],,"['Classical Western', 'Crime', 'Drama', 'Western']",['English']
tt0041622,Malaya,1h 38m,Approved,6.5,1.6K,,Newspaperman Royer convinces government officials of a plan to obtain rubber by smuggling it out from under the Japanese. Carnahan is let out of prison to help.,https://www.imdb.com/title/tt0041622/,"['Frank Fenton', 'Manchester Boddy']",['Richard Thorpe'],"['Spencer Tracy', 'James Stewart', 'Valentina Cortese', 'Sydney Greenstreet', 'John Hodiak', 'Lionel Barrymore', 'Gilbert Roland', 'Roland Winters', 'Richard Loo', 'Ian MacDonald']","$2,396,000 (estimated)",,,,24-04-1950,['United States'],"['Los Angeles County Arboretum & Botanic Garden - 301 N. Baldwin Avenue, Arcadia, California, USA']","[""Loew's""]",,"['Adventure', 'Drama', 'War']",['English']
tt0830535,Disfigured,1h 36m,,6.6,347,,"Lydia is an overweight sales clerk in a trendy home furnishings store, nearing 30. Though she is a member of a Fat Acceptance Group (a movement dedicated to fighting prejudice against overweight people), she is still struggling with complex feelings about her body and its place in the world. Darcy, a recovering-anorexic real estate agent in her mid-20s, is struggling with the same issues from a very different perspective. Her attempt to join the Fat Acceptance Group (since she sees herself as fat) is quickly rejected - but it introduces her to Lydia. Lydia is initially wary of Darcy's efforts to become friends, but Darcy's hunger for emotional contact breaks through the wall of apparent differences and they begin an unexpected friendship. At the same time Lydia gets involved in a sexual relationship with Bob, an overweight man who joins her in walking for exercise early mornings at Venice beach. Stirred emotionally by this new romance and by her conflict with the Fat Acceptance Group, Lydia decides to ask her new friend for an unusual favor: she wants anorexia lessons. When Darcy lets Lydia inside her secret inner world, it forces both women to confront buried feelings about their bodies. Sexuality and fashion, anger and femininity, trust and fear, hunger and satisfaction: there are things that women can only talk about honestly with other women. But they never seem to find a way to do it. This is a movie about two women who do.",https://www.imdb.com/title/tt0830535/,['Glenn Gers'],['Glenn Gers'],"['Deidra Edwards', 'Staci Lawrence', 'Ryan C. Benson', 'Elizabeth Sampson', 'Sonya Eddy', 'Lindsay Hollister', 'Heather Brooker', 'April M. Walsh', 'Juanita Guzman', 'Teebone Mitchell']","$50,000 (estimated)",$585,$829,$829,11-07-2008,['United States'],,"['Launchpad Productions', 'Dialogue Heavy Pictures']",,['Drama'],['English']
tt0071565,Godzilla vs. Mechagodzilla,1h 24m,PG,6.2,8.4K,,"An Okinawan prophecy appears to foretell Earth's destruction at the hands of Godzilla, only for the true Godzilla to reveal his doppelganger as a mechanical alien weapon.",https://www.imdb.com/title/tt0071565/,"['Jun Fukuda', 'Masami Fukushima', ""Shin'ichi Sekizawa""]",['Jun Fukuda'],"['Masaaki Daimon', 'Kazuya Aoyama', 'Reiko Tajima', 'Akihiko Hirata', 'Hiromi Matsushita', 'Hiroshi Koizumi', 'Masao Imafuku', 'Bellbella Lin', 'Shin Kishida', 'Gorô Mutsumi']",,,$549,,28-03-1977,"['Japan', 'United States']","['Okinawa, Japan']","['Toho Eizo Co.', 'Toho']",,"['Alien Invasion', 'Animal Adventure', 'Dinosaur Adventure', 'Kaiju', 'Superhero', 'Supernatural Fantasy', 'Action', 'Family', 'Fantasy', 'Sci-Fi']",['Japanese']
tt0068408,Conquest of the Planet of the Apes,1h 28m,PG,6.1,39K,49,"In a futuristic world that has embraced ape slavery, Caesar, the son of the late simians Cornelius and Zira, surfaces after almost twenty years of hiding out from the authorities, and prepares for a slave revolt against humanity.",https://www.imdb.com/title/tt0068408/,"['Paul Dehn', 'Pierre Boulle']",['J. Lee Thompson'],"['Roddy McDowall', 'Don Murray', 'Ricardo Montalban', 'Natalie Trundy', 'Hari Rhodes', 'Severn Darden', 'Lou Wagner', 'John Randolph', 'Asa Maynor', 'H.M. Wynant']","$1,700,000 (estimated)",,"$9,043,472","$9,043,472",30-06-1972,['United States'],"['University of California, Irvine, California, USA (city exteriors)']","['Twentieth Century Fox', 'APJAC Productions']",,"['Dystopian Sci-Fi', 'Action', 'Sci-Fi']",['English']
