id,title,duration,mpa,rating,votes,méta_score,description,movie_link,writers,directors,stars,budget,opening_weekend_gross,gross_worldwide,gross_us_canada,release_date,countries_origin,filming_locations,production_companies,awards_content,genres,languages
tt0118760,The Boxer,1h 53m,R,7,23K,75,"Young Danny Flynn is released from prison 14 years after ""taking the rap"" for the IRA and tries to rebuild his life in his old Belfast neighborhood.",https://www.imdb.com/title/tt0118760/,"['Jim Sheridan', 'Terry George']",['Jim Sheridan'],"['Daniel Day-Lewis', 'Emily Watson', 'Daragh Donnelly', 'Frank Coughlan', 'Sean Kearns', 'Lorraine Pilkington', 'Niall Shanahan', 'John Wall', 'Maria McDermottroe', 'Carol Moore']",,"$86,097","$16,534,578","$5,980,578",09-01-1998,"['Ireland', 'United States']","['Dublin, County Dublin, Ireland']","['Universal Pictures', ""Hell's Kitchen Films"", ""Hell's Kitchen International""]",,"['Drama', 'Romance', 'Sport']",['English']
tt5013056,Dunkirk,1h 46m,PG-13,7.8,769K,94,"Allied soldiers from Belgium, the British Commonwealth and Empire, and France are surrounded by the German Army and evacuated during a fierce battle in World War II.",https://www.imdb.com/title/tt5013056/,['Christopher Nolan'],['Christopher Nolan'],"['Fionn Whitehead', 'Barry Keoghan', 'Mark Rylance', 'Tom Hardy', 'Damien Bonnard', 'Aneurin Barnard', 'Lee Armstrong', 'James Bloor', 'Tom Glynn-Carney', 'Jack Lowden']","$100,000,000 (estimated)","$50,513,488","$533,696,799","$189,740,665",21-07-2017,"['United Kingdom', 'Netherlands', 'France', 'United States']","['Urk, Flevoland, Netherlands']","['Syncopy', 'Warner Bros.', 'Dombey Street Productions']",,"['Action Epic', 'Epic', 'Historical Epic', 'Period Drama', 'War Epic', 'Action', 'Drama', 'History', 'Thriller', 'War']","['English', 'French', 'German']"
tt1772872,Game,2h 15m,Not Rated,5.2,2.6K,,"A wealthy man invites four people to his private island to blame three of them for his daughter's sudden death. The next morning, the wealthy man is found murdered.",https://www.imdb.com/title/tt1772872/,"['Althea Kaushal', 'Farhan Akhtar']",['Abhinay Deo'],"['Abhishek Bachchan', 'Kangana Ranaut', 'Anupam Kher', 'Boman Irani', 'Jimmy Shergill', 'Shahana Goswami', 'Gauahar Khan', 'Sarah Jane Dias', 'Mantra Mugdh', 'Akash Dhar']",,"$83,783","$1,764,828","$139,528",01-04-2011,['India'],"['Istanbul, Turkey']","['Eros Worldwide', 'Excel Entertainment']",,"['Action', 'Crime', 'Drama', 'Mystery', 'Thriller']","['Hindi', 'English']"
tt0033608,Flight from Destiny,1h 15m,Approved,6.4,335,,"An elderly professor suffering from an aortic aneurysm confronts the problem of what to do, knowing that he only has a few months to live.",https://www.imdb.com/title/tt0033608/,"['Barry Trivers', 'Anthony Berkeley', 'Charles Kenyon']",['Vincent Sherman'],"['Geraldine Fitzgerald', 'Thomas Mitchell', 'Jeffrey Lynn', 'James Stephenson', 'Mona Maris', 'Jonathan Hale', 'David Bruce', 'Thurston Hall', 'Mary Gordon', 'John Eldredge']",,,,,08-02-1941,['United States'],"['Warner Brothers Burbank Studios - 4000 Warner Boulevard, Burbank, California, USA (Studio)']",['Warner Bros.'],,"['Film Noir', 'Drama']",['English']
tt0026400,The Gay Deception,1h 17m,Approved,6.7,482,,"Mirabel wins a $5, 000 lottery which will enable her to live like a queen in New York. There she meets Sandro, a bellboy who is really a prince, so she does get to be a queen after all.",https://www.imdb.com/title/tt0026400/,"['Stephen Morehouse Avery', 'Don Hartman', 'Patterson McNutt']",['William Wyler'],"['Francis Lederer', 'Frances Dee', 'Benita Hume', 'Alan Mowbray', 'Lennox Pawle', 'Adele St. Maur', 'Akim Tamiroff', 'Luis Alberni', 'Lionel Stander', 'Ferdinand Gottschalk']",,,,,13-09-1935,['United States'],,['Fox Film Corporation'],,"['Comedy', 'Drama', 'Romance']","['English', 'Italian']"
tt0013804,Your Best Friend,1h 10m,,,,,"A Jewish mother in New York finds herself at odds with her son's new wife, a pretty Gentile girl.",https://www.imdb.com/title/tt0013804/,['William Nigh'],['William Nigh'],"['Vera Gordon', 'Harry Benham', 'Stanley Price', 'Belle Bennett', 'Beth Mason', 'Dore Davidson']",,,,,26-03-1922,['United States'],,['Harry Rapf Productions'],,['Drama'],"['None', 'English']"
tt0040765,The Search,1h 44m,Approved,7.8,5.1K,85,"In post-war Berlin, an American private helps a lost Czech boy find his mother.",https://www.imdb.com/title/tt0040765/,"['Richard Schweizer', 'David Wechsler', 'Paul Jarrico']",['Fred Zinnemann'],"['Montgomery Clift', 'Ivan Jandl', 'Aline MacMahon', 'Wendell Corey', 'Jarmila Novotna', 'Mary Patton', 'Ewart G. Morrison', 'William Rogers', 'Leopold Borkowski', 'Claude Gambier']","$250,000 (estimated)",,,,26-03-1948,"['Switzerland', 'United States']","['Frankfurt, Germany']",['Praesens-Film'],,"['Drama', 'War']","['English', 'German', 'French', 'Polish', 'Hungarian', 'Czech']"
tt0060086,Alfie,1h 54m,PG,7,16K,70,Unrepentant ladies' man Alfie Elkins gradually begins to understand the consequences of his lifestyle in 1960s London.,https://www.imdb.com/title/tt0060086/,['Bill Naughton'],['Lewis Gilbert'],"['Michael Caine', 'Shelley Winters', 'Millicent Martin', 'Julia Foster', 'Jane Asher', 'Shirley Anne Field', 'Vivien Merchant', 'Eleanor Bron', 'Denholm Elliott', 'Alfie Bass']","$800,000 (estimated)",,,,24-08-1966,['United Kingdom'],"['Chepstow Road, Bayswater, London, England, UK (flat with Annie)']","['Lewis Gilbert', 'Sheldrake Films']",,"['Coming-of-Age', 'Quirky Comedy', 'Comedy', 'Drama']",['English']
tt0033221,Vigil in the Night,1h 36m,Approved,6.7,1.1K,,"A nurse loses her job after selflessly taking the blame for a fatal mistake her sister and co-worker made. She is subsequently employed at a poorly-equipped hospital, where she finds romance and tragedy.",https://www.imdb.com/title/tt0033221/,"['Fred Guiol', 'P.J. Wolfson', 'Rowland Leigh']",['George Stevens'],"['Carole Lombard', 'Anne Shirley', 'Brian Aherne', 'Julien Mitchell', 'Robert Coote', 'Brenda Forbes', 'Rita Page', 'Peter Cushing', 'Ethel Griffies', 'Doris Lloyd']","$920,000 (estimated)",,,,09-02-1940,['United States'],"['RKO Studios - 780 N. Gower Street, Hollywood, Los Angeles, California, USA (Studio)']",['RKO Radio Pictures'],,"['Drama', 'Romance']",['English']
tt13363828,We Need to Do Something,1h 37m,Unrated,4.5,4.1K,48,"After Melissa and her family seek shelter from a storm, they become trapped. With no sign of rescue, Melissa comes to realize that she and her girlfriend Amy might have something to do with the horrors that threaten her family.",https://www.imdb.com/title/tt13363828/,['Max Booth III'],"[""Sean King O'Grady""]","['Sierra McCormick', 'Vinessa Shaw', 'Pat Healy', 'Lisette Olivera', 'John James Cronin', 'Ozzy Osbourne', 'Logan Kearney', 'Dan John Miller']",,"$6,009","$15,318","$13,589",03-09-2021,['United States'],"['Detroit, Michigan, USA']","['Atlas Industries', 'Spin a Black Yarn', 'A Bigger Boat']",,"['Horror', 'Mystery']",['English']
tt0018381,Señorita,1h 10m,,6.6,39,,"At the age of 20, Francesca Hernández is as skillful at riding, shooting, and fencing as any man. At the ancestral Hernández ranch in South America, her grandfather, Don Francisco, is suffering from the depredations of his old enemies, the Oliveros family, and believing his grandchild to be a boy, he calls for ""his"" aid. Francesca responds, and, when apprised of the situation, dons the costume of a caballero, and through a series of sensational episodes recoups the family fortune. Meanwhile, Roger Oliveros returns from Europe, unaware of his cousin Ramón's scheming and banditry, and falls in love with Francesca (out of disguise). She routs Ramón in a duel and is later forced to fight the man she loves. Ramón leads an attack on the ranch; Roger does not recognize Francesca until he has wounded her, and as a result, the feud is ended.",https://www.imdb.com/title/tt0018381/,"['Lloyd Corrigan', 'John McDermott']",['Clarence G. Badger'],"['Bebe Daniels', 'James Hall', 'William Powell', 'Josef Swickard', 'Tom Kennedy', 'Jerry Mandy', 'Raoul Paoli', 'Pedro Regas']",,,,,28-04-1927,['United States'],"['Paramount Studios - 5555 Melrose Avenue, Hollywood, Los Angeles, California, USA (Studio)']",['Paramount Pictures'],,"['Action', 'Comedy']",['English']
tt0449487,Passengers,1h 33m,PG-13,5.8,40K,40,A grief counselor working with a group of plane-crash survivors finds herself at the root of a mystery when her clients begin to disappear.,https://www.imdb.com/title/tt0449487/,['Ronnie Christensen'],['Rodrigo García'],"['Anne Hathaway', 'Patrick Wilson', 'David Morse', 'Andre Braugher', 'Dianne Wiest', 'William B. Davis', 'Ryan Robbins', 'Clea DuVall', 'Don Thompson', 'Andrew Wheeler']","$25,000,000 (estimated)","$172,544","$5,798,974","$292,437",26-09-2008,"['United States', 'Canada']","['University of British Columbia, Robson Square Campus - 800 Robson Street, Vancouver, British Columbia, Canada (hospital)']","['TriStar Pictures', 'Mandate Pictures', 'Persistent Entertainment']",,"['Mystery', 'Romance', 'Thriller']",['English']
tt0092005,Stand by Me,1h 29m,R,8.1,461K,75,A writer recounts a childhood journey with his friends to find the body of a missing boy.,https://www.imdb.com/title/tt0092005/,"['Stephen King', 'Raynold Gideon', 'Bruce A. Evans']",['Rob Reiner'],"['Wil Wheaton', 'River Phoenix', 'Corey Feldman', ""Jerry O'Connell"", 'Kiefer Sutherland', 'Casey Siemaszko', 'Gary Riley', 'Bradley Gregg', 'Jason Oliver Lipsett', 'Marshall Bell']","$8,000,000 (estimated)","$242,795","$53,525,035","$52,287,414",22-08-1986,['United States'],"['Eagle Mountain Ln, Burney, California, USA (trestle bridge)']","['Columbia Pictures', 'Act III', 'Act III Communications']",,"['Coming-of-Age', 'Dark Comedy', 'Quest', 'Adventure', 'Comedy', 'Drama']",['English']
tt5807330,Tread,1h 29m,,7.1,3.8K,66,"Pushed to his breaking point, a master welder in a small town at the foot of the Rocky Mountains quietly fortifies a bulldozer with 30 tons of concrete and steel and seeks to destroy those he believes have wronged him.",https://www.imdb.com/title/tt5807330/,['Paul Solet'],['Paul Solet'],"['Marvin Heemeyer', 'Patrick Brower', 'Glenn Trainor Jr.', 'Casey Farrell', 'Trisha MacDonald', 'Stuart Spencer', 'Matt Reed', 'Cody Docheff', 'Ben McClelland', 'Dick Thompson']",,"$10,585","$36,527","$36,527",28-02-2020,['United States'],"['Granby, Colorado, USA (location)']","['Zipper Bros Films', 'Sutter Road Picture Company']",,"['Crime Documentary', 'Crime', 'Documentary']",['English']
tt0179861,Icebreaker,1h 30m,PG-13,3.5,1.4K,,At the the Killington ski resort something has gone awry. Evil terrorists led by the sinister Greig have taken the resort hostage with a stolen nuclear device. It's up to Ski Patrol bum Matt Foster to save the day - and his fiancé.,https://www.imdb.com/title/tt0179861/,['David Giancola'],['David Giancola'],"['Sean Astin', 'Bruce Campbell', 'Stacy Keach', 'Suzanne Turner', 'John James', ""Mark 'Woody' Keppel"", 'Paul Schnabel', 'Rick Kincaid', 'Rusty De Wees', 'Steve Mellor']",,,,,01-05-2000,['United States'],"['Killington Ski Resort - 4763 Killington Road, Killington, Vermont, USA']","['Edgewood Studios', 'Two Left Shoes Films']",,"['Action', 'Drama']",['English']
tt27729779,The Platform 2,1h 39m,TV-MA,4.9,39K,45,"A thrilling physical journey that allows an approach to the darkness, where it is scary to look. It appeals to the viewer's civil responsibility and forces them to face the limits of their own solidarity.",https://www.imdb.com/title/tt27729779/,"['Galder Gaztelu-Urrutia', 'Pedro Rivero', 'David Desola']",['Galder Gaztelu-Urrutia'],"['Milena Smit', 'Hovik Keuchkerian', 'Natalia Tena', 'Óscar Jaenada', 'Ivan Massagué', 'Zorion Eguileor', 'Bastien Ughetto', 'Armando Buika', 'Pedro Bachura', 'Antonia San Juan']",,,,,04-10-2024,['Spain'],"['Bilbao, Spain']",['Basque Films'],,"['Dystopian Sci-Fi', 'Horror', 'Sci-Fi', 'Thriller']",['Spanish']
tt7233726,Default,1h 54m,,6.7,1.6K,,"A dramatization of the behind-the-scenes story of the IMF negotiations that took place during the financial crisis in 1997, through three parallel stories.",https://www.imdb.com/title/tt7233726/,['Eom Seong-min'],['Kook-Hee Choi'],"['Kim Hye-su', 'Yoo Ah-in', 'Huh Joon-ho', 'Jo Woo-jin', 'Vincent Cassel', 'Kim Tae-Yul', 'Kwon Hae-hyo', 'Kim Roe-ha', 'Eom Hyo-Seob', 'Ryu Deok-hwan']",,"$50,011","$27,694,043","$203,775",28-11-2018,['South Korea'],"['Hapcheon, South Korea']",['Zip Cinema'],,"['Drama', 'History', 'Financial Drama']","['Korean', 'English']"
tt0177912,Madame Sans-Gêne,1h 40m,,6.8,79,,"The ordeals of a crude washerwoman in the chic court of Napoleon the First;La Maréchale Lefèvre ,a former launderer who followed the emperor in many of his campaigns is the laughing stock of the court .Although she takes lessons in deportment ,she 's not able to learn good manners and the posh new aristocrats snub her and call her names .When the emperor, his wife Marie-Louise and Neipperg are involved in an intrigue,she saves the situation.",https://www.imdb.com/title/tt0177912/,"['Jean Aurenche', 'Pierre Lestringuez', 'Émile Moreau']",['Roger Richebé'],"['Arletty', 'Aimé Clariond', 'Maurice Escande', 'Henri Nassiet', 'Jeanne Reinhardt', 'Madeleine Sylvain', 'Albert Dieudonné', 'Geneviève Auger', 'Mona Dol', 'Ror Volmar']",,,,,07-10-1941,['France'],"['Studios Saint Maurice, Val-de-Marne, France (Studio)']",['Films Roger Richebé'],,"['Comedy', 'Drama', 'History']",['French']
tt0084780,A Tight Spot,1h 32m,,8.2,3.9K,,"In this light, fluffy comedy, a low-level clerk cannot make ends meet because his brood is in no way economically cooperative: his daughter is a lawyer looking for work, unsuccessfully; his son is a would-be astronomer who wants to spend his life studying without working; and his other son wants his own wheels. It is enough to send a father to the lottery, or to the soccer pool.",https://www.imdb.com/title/tt0084780/,"['Ljiljana Pavic', 'Sinisa Pavic']","[""Milivoje 'Mica' Milosevic""]","['Nikola Simic', ""Milan 'Lane' Gutovic"", 'Rahela Ferari', 'Ruzica Sokic', 'Irfan Mensur', 'Jelica Sretenovic', 'Danica Maksimovic', 'Nada Vojinovic', 'Aleksandar Todorovic', 'Gojko Baletic']",,,,,24-09-1982,['Yugoslavia'],,"['Film Danas', 'Union Film']",,['Comedy'],['Serbo-Croatian']
tt0023031,Hotel Splendide,53m,,6.2,92,,Jerry Mason inherits a seaside hotel but discovers that a gang of robbers have buried their loot on the site where the hotel now stands.,https://www.imdb.com/title/tt0023031/,"['Philip MacDonald', 'Ralph Smart']",['Michael Powell'],"['Jerry Verno', 'Anthony Holles', 'Edgar Norfolk', 'Philip Morant', 'Sybil Grove', 'Vera Sherborne', 'Paddy Browne', 'Michael Powell', 'George Spence']","£4,000 (estimated)",,,,18-07-1932,['United Kingdom'],"['Nettlefold Studios, Walton-on-Thames, Surrey, England, UK (Studio)']",['Film Engineering'],,"['Crime', 'Drama']",['English']
tt0058458,The Soft Skin,1h 53m,Not Rated,7.5,8.7K,78,"Pierre Lachenay is a well-known publisher and lecturer, married with Franca and father of Sabine, around 10. He meets an air hostess, Nicole. They start a love affair, which Pierre is hiding, but he cannot stand staying away from her.",https://www.imdb.com/title/tt0058458/,"['François Truffaut', 'Jean-Louis Richard']",['François Truffaut'],"['Jean Desailly', 'Françoise Dorléac', 'Nelly Benedetti', 'Daniel Ceccaldi', 'Laurence Badie', 'Philippe Dumat', 'Paule Emanuele', 'Maurice Garrel', 'Sabine Haudepin', 'Dominique Lacarrière']",,"$11,206","$30,706",$509,20-04-1964,['France'],"['Lisbon, Portugal']","['Les Films du Carrosse', ""Societé d'Exploitation et de Distribution de Films (SEDIF)"", 'Simar Films']",,"['Drama', 'Romance']","['French', 'Portuguese', 'English']"
tt0388139,It's All Gone Pete Tong,1h 30m,R,7.2,21K,56,A famous DJ in the Ibiza club scene finds the alcohol and drug-fueled party that is his life threatened by the progressive loss of his hearing.,https://www.imdb.com/title/tt0388139/,['Michael Dowse'],['Michael Dowse'],"['Paul Kaye', 'Beatriz Batarda', 'Kate Magowan', 'Mike Wilmot', 'Neil Maskell', 'Monica Maja', 'Pete Tong', 'Ron Lloy Hugh Elliston', 'Dan Antopolski', 'Tim Plester']","$2,000,000 (estimated)","$19,717","$1,635,056","$120,620",27-05-2005,"['United Kingdom', 'Canada']","['Ibiza, Balearic Islands, Spain']","['True West Films', 'Vertigo Films']",,"['Dark Comedy', 'Mockumentary', 'Biography', 'Comedy', 'Drama', 'Music']",['English']
tt0049484,Mermaid of Naples,1h 32m,,5.1,41,,"Maruzzella is in love with Salvatore but Salvatore is infatuated with Donna Carmela who is the step-mother of Maruzzella. Besides, Carmela deprived Maruzzella of her inheritance. When Salvatore asks Renato, an old school-mate of his, to stay with him, the situation is slowly resolved.",https://www.imdb.com/title/tt0049484/,"['Luigi Capuano', 'Alfredo Giannetti']",['Luigi Capuano'],"['Marisa Allasio', 'Massimo Serato', 'Yvette Lebon', 'Adolfo Geri', 'Virginia Balestrieri', 'Carlo Tamberlani', 'Nerio Bernardi', 'Paolo Ferrara', 'Flora Carosello', 'Pasquale De Filippo']",,,,,27-09-1956,"['Italy', 'France']",,['Romana Film'],,"['Comedy', 'Musical']",['Italian']
tt0036170,The Moon Is Down,1h 30m,,7,586,,"During the Nazi occupation of Norway, a small Norwegian village struggles to cope with the invaders and some locals choose collaboration while others prefer armed resistance.",https://www.imdb.com/title/tt0036170/,"['Nunnally Johnson', 'John Steinbeck']",['Irving Pichel'],"['Cedric Hardwicke', 'Henry Travers', 'Lee J. Cobb', 'Dorris Bowdon', 'Margaret Wycherly', 'Peter van Eyck', 'William Post Jr.', 'Henry Rowland', 'E.J. Ballantine', 'Hans Schumm']",,,,,29-07-1943,['United States'],"['Big Bear Lake, Big Bear Valley, San Bernardino National Forest, California, USA']",['Twentieth Century Fox'],,"['Drama', 'War']",['English']
tt0226590,In Spring,1h 19m,,7.6,230,,"In Spring is a masterpiece of Ukrainian cinema avant-garde, a non-fiction film made by Mikhail Kaufman, Dziga Vertov's brother and co-author, along the lines of the avant-gardist theory of «cine-eye». The film shows Kyiv in 1929, almost unknown today. Pictures of wakening city, its resurging life resonate with lyrical views of reviving nature. Kaufman's attentive camera dwells deliberately on smiling faces of children, lyrically depicting a declaration of love to Kyiv. In In Spring, Kaufman used the method of «hidden camera» for the first time.",https://www.imdb.com/title/tt0226590/,['Mikhail Kaufman'],['Mikhail Kaufman'],,,,,,25-10-1929,['Soviet Union'],"['Kyiv, Ukraine']","['Vseukrainske Foto Kino Upravlinnia (VUFKU)', 'Kyivska Kinofabryka']",,['Documentary'],['None']
tt0017945,Good as Gold,50m,,,,,"When Buck Brady is a child, his father's mine is stolen, and he grows up planning to revenge the injustice. He finally retaliates by holding up the mine's payroll messengers. He falls in love with Janet Laurier, later learns that she is the owner of the mine, then saves her from the crooked foreman Tilford and fights him on a moving car that finally falls off the edge of a cliff.",https://www.imdb.com/title/tt0017945/,"['Jack Jungmeyer', 'Murray Leinster']",['Scott R. Dunlap'],"['Buck Jones', 'Frances Lee', 'Carl Miller', 'Charles K. French', 'Adele Watson', 'Arthur Ludwig', 'Michael D. Moore']",,,,,12-06-1927,['United States'],,['Fox Film Corporation'],,['Western'],['English']
tt0062860,Danger Route,1h 32m,Approved,5.6,535,,"During the Cold War, a British secret agent is ordered to kill a Soviet-bloc defector held by the CIA in England but this straightforward mission turns into a convoluted plot involving double-agents.",https://www.imdb.com/title/tt0062860/,"['Meade Roberts', 'Andrew York', 'Robert Banks Stewart']",['Seth Holt'],"['Richard Johnson', 'Carol Lynley', 'Barbara Bouchet', 'Sylvia Syms', 'Diana Dors', 'Harry Andrews', 'Sam Wanamaker', 'Gordon Jackson', 'Maurice Denham', 'David Bauer']",,,,,13-04-1968,['United Kingdom'],"['Shepperton Studios, Studios Road, Shepperton, Surrey, England, UK (Studio)']",['Amicus Productions'],,"['Action', 'Drama', 'Thriller']","['English', 'French']"
tt0119008,Donnie Brasco,2h 7m,R,7.7,343K,77,An FBI undercover agent infiltrates the mob and finds himself identifying more with the Mafia life--at the expense of his regular one.,https://www.imdb.com/title/tt0119008/,"['Joseph D. Pistone', 'Richard Woodley', 'Paul Attanasio']",['Mike Newell'],"['Al Pacino', 'Johnny Depp', 'Michael Madsen', 'Bruno Kirby', 'James Russo', 'Anne Heche', 'Zeljko Ivanek', 'Gerry Becker', 'Robert Miano', 'Brian Tarantina']","$35,000,000 (estimated)","$11,660,216","$124,909,762","$41,909,762",28-02-1997,['United States'],"[""Katz's Delicatessen - 205 East Houston Street, Lower East Side, Manhattan, New York City, New York, USA""]","['Mandalay Entertainment', 'Baltimore Pictures', 'Mark Johnson Productions']",,"['Docudrama', 'Gangster', 'True Crime', 'Biography', 'Crime', 'Drama']","['English', 'Italian', 'Japanese']"
tt21064584,The Iron Claw,2h 12m,R,7.6,103K,73,"The true story of the inseparable Von Erich brothers, who made history in the intensely competitive world of professional wrestling in the early 1980s.",https://www.imdb.com/title/tt21064584/,['Sean Durkin'],['Sean Durkin'],"['Zac Efron', 'Jeremy Allen White', 'Harris Dickinson', 'Maura Tierney', 'Holt McCallany', 'Grady Wilson', 'Valentine Newcomer', 'Scott Innes', 'Chavo Guerrero Jr.', 'Garrett Hammond']","$15,000,000 (estimated)","$4,868,370","$45,204,449","$35,070,296",22-12-2023,"['United Kingdom', 'United States']","['Baton Rouge, Louisiana, USA']","['A24', 'Access Entertainment', 'BBC Film']",,"['Docudrama', 'Tragedy', 'Biography', 'Drama', 'Sport']",['English']
tt0275688,Snipes,1h 53m,R,5.3,494,32,"Erik is an ambitious teenager who spends more time posting fliers for his favorite rapper, Prolifik, than sitting in the classroom. When he and his best friend stumble across a dead body one night, they trigger a series of tragic events.",https://www.imdb.com/title/tt0275688/,"['Rob Wiser', 'Rich Murray']",['Rich Murray'],"['Sam Jones III', 'Nelly', 'Zoe Saldaña', 'Dean Winters', 'Rashaan Nall', 'Schoolly D', 'Joel Marsh Garland', 'J.D. Williams', 'Mpho Koaho', 'Victor Togunde']",,"$14,027","$70,569","$70,569",04-09-2002,['United States'],"['Philadelphia, Pennsylvania, USA']",['Ruff Nation Films'],,"['Action', 'Drama', 'Music', 'Mystery', 'Thriller']",['English']
tt9428746,Aristotle and Dante Discover the Secrets of the Universe,1h 38m,PG-13,7.1,2.9K,69,"Mexican teenagers Aristotle Mendoza and Dante Quintana explore their friendship while struggling with racial and ethnic identity, sexuality and family relationships in 1987 El Paso, Texas.",https://www.imdb.com/title/tt9428746/,"['Aitch Alberto', 'Benjamin Alire Sáenz']",['Aitch Alberto'],"['Max Pelayo', 'Reese Gonzales', 'Veronica Falcón', 'Eugenio Derbez', 'Eva Longoria', 'Kevin Alejandro', 'Jose Diaz', 'Maynor Alvarado', 'Marlene Forte', 'Isabella Gomez']",,"$230,205","$407,838","$407,838",08-09-2023,['United States'],"['El Paso, Texas, USA']","['Limelight', 'Boies Schiller Entertainment', '3Pas Studios']",,['Drama'],"['English', 'Spanish']"
tt21109538,Hansan: Rising Dragon,2h 10m,,6.6,2.3K,,"Follow-up to 2014's The Admiral: Roaring Currents, which explores the historic Battle of Hansan Island.",https://www.imdb.com/title/tt21109538/,"['Kim Han-min', 'Hong-gi Yun']",['Kim Han-min'],"['Park Hae-il', 'Byun Yo-han', 'Allen Chan', 'Kim Gu-taek', 'Kim Hyang-gi', 'Han Hyeon-jik', 'Son Hyeon-ju', 'Park Hyung-jun', 'Park Jae-min', 'Jo Jae-yoon']",,"$287,554","$57,490,985","$865,888",27-07-2022,['South Korea'],"['Yeosu, South Jeolla Province, South Korea (exterior location settings)']",['Big Stone Pictures'],,"['Period Drama', 'Action', 'Drama', 'History', 'War']","['Korean', 'Japanese']"
tt0018841,Dom na Trubnoy,1h 4m,Not Rated,7.2,761,,"A girl Parasha Pitunova comes to Moscow from a deep province, eventually she arrives at a house. This is a story about the house and its inhabitants.",https://www.imdb.com/title/tt0018841/,"['Nikolay Erdman', 'Anatoli Marienhof', 'Vadim Shershenevich']",['Boris Barnet'],"['Vera Maretskaya', 'Anel Sudakevich', 'Ada Voytsik', 'Vladimir Fogel', 'Elena Tyapkina', 'Vladimir Batalov', 'Pyotr Baksheyev', 'Boris Barnet', 'Aleksandr Gromov', 'Sergey Komarov']",,,,,31-08-1928,['Soviet Union'],,['Mezhrabpomfilm'],,['Comedy'],"['None', 'Russian']"
tt0042646,King Solomon's Mines,1h 43m,Approved,6.7,7.3K,69,Adventurer Allan Quartermain leads an expedition into uncharted African territory in an attempt to locate an explorer who went missing during his search for the fabled diamond mines of King Solomon.,https://www.imdb.com/title/tt0042646/,"['Helen Deutsch', 'H. Rider Haggard']","['Compton Bennett', 'Andrew Marton']","['Deborah Kerr', 'Stewart Granger', 'Richard Carlson', 'Hugo Haas', 'Lowell Gilmore', 'Kimursi', 'Siriaque', 'Sekaryongo', 'Baziga', 'Munto Anampio']","$2,258,000 (estimated)",,$951,,24-11-1950,['United States'],"['Carlsbad Caverns National Park - 727 Carlsbad Caverns Highway, Carlsbad, New Mexico, USA (underground mines)']",['Metro-Goldwyn-Mayer (MGM)'],,"['Adventure Epic', 'Jungle Adventure', 'Quest', 'Steamy Romance', 'Survival', 'Action', 'Adventure', 'Romance']",['English']
