id,title,duration,mpa,rating,votes,méta_score,description,movie_link,writers,directors,stars,budget,opening_weekend_gross,gross_worldwide,gross_us_canada,release_date,countries_origin,filming_locations,production_companies,awards_content,genres,languages
tt0082677,Looker,1h 33m,PG,6.1,6.5K,20,"Three of four models, who had plastic surgery done by Larry after a computed list, are dead. Neither the cops nor Larry believe they're suicides. Larry investigates and stays with the fourth model. Who's behind the lists and murders?",https://www.imdb.com/title/tt0082677/,['Michael Crichton'],['Michael Crichton'],"['Albert Finney', 'James Coburn', 'Susan Dey', 'Leigh Taylor-Young', 'Dorian Harewood', 'Tim Rossovich', 'Darryl Hickman', 'Kathryn Witt', 'Terri Welles', 'Michael Hawkins']","$8,000,000 (estimated)",,,,30-10-1981,['United States'],"[""Art Center College of Design, Pasadena, California, USA (Interiors and exteriors. As 'Digital Matrix Inc.' headquarters building.)""]","['The Ladd Company', 'Warner Bros.']",,"['Artificial Intelligence', 'Cyberpunk', 'Drama', 'Sci-Fi', 'Thriller']",['English']
tt0022404,Smart Woman,1h 8m,Passed,6.5,550,,A wife turns the tables on her cheating husband.,https://www.imdb.com/title/tt0022404/,"['Myron C. Fagan', 'Salisbury Field']",['Gregory La Cava'],"['Mary Astor', 'Robert Ames', 'John Halliday', 'Edward Everett Horton', 'Noel Francis', 'Ruth Weston', 'Gladys Gale', 'Alfred Cross', 'Lillian Harmer', 'Bill Elliott']",,,,,12-09-1931,['United States'],"[""San Marino, California, USA (exteriors: Wilson home and gardens used for the Gibson's house)""]",['RKO Radio Pictures'],,"['Romantic Comedy', 'Satire', 'Screwball Comedy', 'Comedy', 'Drama', 'Romance']",['English']
tt0016893,Footloose Widows,1h 10m,,6.8,22,,"New York models Flo and Marian entice their employer to give them each a fine wardrobe for a party, then slip off to Florida and install themselves in a luxury hotel, posing as two wealthy widows. While Flo captures the fancy of ""The Senator,"" a solid citizen, she has Marian plot to ensnare a Mr. Smith, supposedly a millionaire, but Marian accidentally meets Jerry, a personable and charming young man (actually Mr. Smith) and falls in love with him. Under pressure from Flo, Marian finally accepts Smith's ardent proposal of marriage, each supposing the other to be wealthy; but Dunn, the girls' employer, arrives and has them arrested. Jerry, disillusioned, pays their hotel bills; Marian returns his gift of $1,000 and declares her love for him. The two are married, and Flo continues her interrupted courtship with ""The Senator.""",https://www.imdb.com/title/tt0016893/,"['Roy Del Ruth', 'Beatrice Burton Morgan', 'Jack Wagner']",['Roy Del Ruth'],"['Louise Fazenda', 'Jacqueline Logan', 'Jason Robards Sr.', 'Douglas Gerrard', 'Neely Edwards', 'Arthur Hoyt', 'Jane Winton', 'Mack Swain', 'John Miljan', 'Eddie Phillips']",,,,,19-06-1926,['United States'],,['Warner Bros.'],,['Comedy'],"['None', 'English']"
tt8363914,No Safe Spaces,1h 40m,PG-13,7.1,2.9K,31,No Safe Spaces contends that identity politics and the suppression of free speech are spreading into every part of society and threatening to divide America.,https://www.imdb.com/title/tt8363914/,['John Sullivan'],['Justin Folk'],"['Adam Carolla', 'Dennis Prager', 'Jordan B. Peterson', 'Ben Shapiro', 'Dave Rubin', 'Tim Allen', 'Sharyl Attkisson', 'Silvia Baldassini', 'Spencer Brown', 'Bryan Callen']",,"$45,236","$1,291,514","$1,291,514",25-10-2019,['United States'],"['Laugh Factory Comedy Club, 8001 Sunset Boulevard, Los Angeles, California, USA']","['Madison McQueen', 'Dangerous Documentaries', 'Hashtag Productions']",,"['News', 'Documentary', 'War']",['English']
tt0177359,The Way of a Maid,50m,Passed,,,,"Returning to a friend's apartment after a masquerade ball where she has won first prize as a lady's maid, society girl Naida Castleton is mistaken for the housemaid by Thomas Lawlor. He is struck by her beauty, however, and in a spirit of mischief she keeps up the deception. Naida suffers a financial misfortune, and she is obliged to sell her city property and lease her summer home, which is acquired by Tom's socially ambitious mother; Naida then continues in the role of secretary to Mr. Lawlor, who does not suspect her deception. While shopping, Naida is discovered by her friends and taken to her home, where she serves them cocktails. Mrs. Lawlor arrives and, realizing the situation, pretends to be a guest. Before Tom discovers the truth, he proposes to her, and after revealing her true identity, she accepts.",https://www.imdb.com/title/tt0177359/,"['Rex Taylor', 'Lewis Allen Browne']",['William P.S. Earle'],"['Elaine Hammerstein', 'Niles Welch', 'Diana Allen', 'Charles D. Brown', 'George Fawcett', 'Arthur Housman', 'Helen Lindroth']",,,,,30-11-1921,['United States'],,['Selznick Pictures Corporation'],,"['Comedy', 'Drama']",['None']
tt0282410,Chance,1h 15m,Unrated,6.8,1.3K,,A young woman tries to find the right man to be with while dealing with her own life and family problems.,https://www.imdb.com/title/tt0282410/,['Amber Benson'],['Amber Benson'],"['Amber Benson', 'James Marsters', 'Tressa DiFiglia', 'Andy Hallett', 'Lars Woods', 'Jeff Ricketts', 'Nate Barlow', 'Shamus Murphy', 'David Fury', 'Cathy Doe']","$75,000 (estimated)",,,,22-09-2002,['United States'],"['Los Angeles, California, USA']",['Benson Entertainment Inc.'],,"['Comedy', 'Drama']",['English']
tt6263850,Deadpool & Wolverine,2h 8m,R,7.6,482K,56,"Deadpool is offered a place in the Marvel Cinematic Universe by the Time Variance Authority, but instead recruits a variant of Wolverine to save his universe from extinction.",https://www.imdb.com/title/tt6263850/,"['Ryan Reynolds', 'Rhett Reese', 'Paul Wernick']",['Shawn Levy'],"['Ryan Reynolds', 'Hugh Jackman', 'Emma Corrin', 'Matthew Macfadyen', 'Dafne Keen', 'Jon Favreau', 'Morena Baccarin', 'Rob Delaney', 'Leslie Uggams', 'Jennifer Garner']","$200,000,000 (estimated)","$211,435,291","$1,338,073,645","$636,745,858",26-07-2024,"['United States', 'United Kingdom', 'New Zealand', 'Canada']","['Vancouver Film Studios - 3500 Cornett Rd, Vancouver, British Columbia, Canada']","['Marvel Studios', '20th Century Studios', 'Maximum Effort']",,"['Buddy Comedy', 'Dark Comedy', 'Raunchy Comedy', 'Superhero', 'Action', 'Adventure', 'Comedy', 'Sci-Fi']","['English', 'French', 'Spanish']"
tt0047415,Rigoletto e la sua tragedia,1h 31m,,5,31,,A musical drama based on Giuseppe Verdi's opera Rigoletto.,https://www.imdb.com/title/tt0047415/,"['Francesco Maria Piave', 'Flavio Calzavara', 'Jacopo Corsi']",['Flavio Calzavara'],"['Aldo Silvani', 'Tito Gobbi', 'Janet Vidor', 'Pina Arnaldi', 'Gérard Landry', 'Mario Del Monaco', 'Loris Gizzi', 'Cesare Polacco', 'Franca Tamantini', 'Gualtiero Tumiati']",,,,,20-04-1956,['Italy'],,['Diva Film S.p.a.'],,"['Musical', 'Romance']",['Italian']
tt3001638,Mary Kom,2h 2m,Not Rated,6.8,12K,,"A chronicle of the life of Indian boxer Mary Kom, who went through several hardships before audaciously accomplishing her ultimate dream.",https://www.imdb.com/title/tt3001638/,"['Saiwyn Quadras', 'Ramendra Vasishth', 'Karan Singh Rathore']",['Omung Kumar'],"['Priyanka Chopra Jonas', 'Sunil Thapa', 'Robin Das', 'Rajni Basumatary', 'Darshan Kumaar', 'Lin Laishram', 'Bijou Thaangjam', 'Kenny Basumatary', 'Zachary Coffin', 'Shiva Dagar']",,"$370,277","$839,840","$621,300",05-09-2014,['India'],,"['Bhansali Productions', 'Prime Focus World', 'Viacom18 Motion Pictures']",,"['Action', 'Biography', 'Drama', 'Sport']",['Hindi']
tt0272062,Daag: The Fire,2h 32m,,5,852,,"Karan, a former soldier tries to extract revenge from a corrupted lawyer. In the process, the lawyer loses his mental balance and Karan needs to treat him to get him killed.",https://www.imdb.com/title/tt0272062/,"['Robin Bhatt', 'Jainendra Jain', 'Raj Kanwar']",['Raj Kanwar'],"['Sanjay Dutt', 'Chandrachur Singh', 'Mahima Chaudhry', 'Shakti Kapoor', 'Sushma Seth', 'Mohan Joshi', 'Deepak Shirke', 'Harish Patel', 'Himani Shivpuri', 'Sachin Khedekar']",,,,,12-02-1999,['India'],,['Inderjit Films Combine'],,"['Action', 'Drama', 'Thriller']",['Hindi']
tt0297144,Ghosts of the Abyss,1h 1m,G,6.8,6.6K,67,"James Cameron and Bill Paxton, director and actor of the 1997 film Titanic, travel to the final undersea resting place of the ill-fated ship of dreams.",https://www.imdb.com/title/tt0297144/,"['Bill Paxton', 'Lori Johnston', 'Lewis Abernathy']",['James Cameron'],"['Bill Paxton', 'Lori Johnston', 'Lewis Abernathy', 'John Broadwater', 'Charles Pellegrino', 'Don Lynch', 'Ken Marschall', 'James Cameron', 'Mike Cameron', 'Jeffrey N. Ledda']","$13,000,000 (estimated)","$1,408,474","$27,570,076","$17,040,871",10-09-2003,"['France', 'United States']","['Titanic wreck, Titanic Canyon, North Atlantic, Atlantic Ocean']","['Walt Disney Pictures', 'Walden Media', 'Earthship Productions']",,"['Documentary', 'Family']",['English']
tt0298744,Auto Focus,1h 45m,R,6.7,16K,66,The life of TV star Bob Crane and his strange friendship with electronics expert John Henry Carpenter.,https://www.imdb.com/title/tt0298744/,"['Robert Graysmith', 'Michael Gerbosi']",['Paul Schrader'],"['Greg Kinnear', 'Willem Dafoe', 'Maria Bello', 'Rita Wilson', 'Ron Leibman', 'Bruce Solomon', 'Michael E. Rodgers', 'Kurt Fuller', 'Christopher Neiman', 'Lyle Kanouse']","$7,000,000 (estimated)","$123,761","$2,704,951","$2,063,196",01-11-2002,['United States'],"['Los Angeles, California, USA']","['Focus Puller Inc.', 'Good Machine', 'Propaganda Films']",,"['True Crime', 'Biography', 'Crime', 'Drama']",['English']
tt0072641,"Amori, letti e tradimenti",1h 30m,,3.8,84,,,https://www.imdb.com/title/tt0072641/,['Mauro Righi'],['Alfonso Brescia'],"['Marisa Mell', 'Don Backy', 'Ugo Bologna', 'Sonia Viviani', 'Malisa Longo', 'Enzo Spitaleri', 'Franco Cremonini', 'Riccardo Parisio Perrotti', 'Roberto Giraudo', 'Paola Maiolini']",,,,,01-01-1975,['Italy'],"[""Villa di Casal Lumbroso, Roma, Lazio, Italy (Commendator Guido Mordacchia's House)""]",['Alexandra Film'],,['Comedy'],['Italian']
tt0277434,We Were Soldiers,2h 18m,R,7.2,155K,65,"The story of the first major battle of the American phase of the Vietnam War, and the soldiers on both sides that fought it, while their wives wait nervously and anxiously at home for the good news or the bad news.",https://www.imdb.com/title/tt0277434/,"['Harold G. Moore', 'Joseph Lee Galloway', 'Randall Wallace']",['Randall Wallace'],"['Mel Gibson', 'Madeleine Stowe', 'Greg Kinnear', 'Sam Elliott', 'Chris Klein', 'Keri Russell', 'Barry Pepper', 'Duong Don', 'Ryan Hurst', 'Robert Bagnell']","$75,000,000 (estimated)","$20,212,543","$115,374,915","$78,122,718",01-03-2002,"['United States', 'France', 'Germany', 'United Kingdom']","['Fort Hunter Liggett, California, USA (Central Highlands, South Vietnam)']","['Icon Entertainment International', 'Motion Picture Production GmbH & Co. Erste KG', 'StudioCanal']",,"['Action', 'Drama', 'History', 'War']","['English', 'Vietnamese', 'French']"
tt0013126,Find the Woman,1h,,,,,"Clancy Deane, who leaves her home in Ohio for a career on the New York stage, makes the acquaintance of the Webers, tools of Maurice Beiner, a blackmailer operating under the cover of a theatrical agency. While in Beiner's office seeking an engagement, Clancy witnesses his being stunned by a fall over a table. She leaves by a window, and on the fire escape she encounters Mrs. Carey, who wants to secure some letters. When Beiner's murder is investigated, Mrs. Carey is implicated but is released after examination. Judge Walbrough is knocked out by an unknown assailant, whose fingerprints are identical with those on the knife that killed Beiner. Following numerous complications, Don Carey, a dissolute alcoholic who kills himself, is revealed as the murderer. Clancy marries Philip Vandevent, and Judge Walbrough wins Sophie Carey.",https://www.imdb.com/title/tt0013126/,"['Doty Hobart', 'Arthur Somers Roche']",['Tom Terriss'],"['Alma Rubens', 'Eileen Huban', 'Harrison Ford', 'George MacQuarrie', 'Norman Kerry', 'Ethel Duray', 'Arthur Donaldson', 'Henry Sedley', 'Sydney Deane', 'Emily Fitzroy']",,,,,02-04-1922,['United States'],"['Long Island, New York, USA (Studio)']",['Cosmopolitan Productions'],,"['Drama', 'Mystery']",['None']
tt0013778,The Woman Conquers,50m,,,,,"Tired of her friends and life as a society leader, Ninon Le Compte goes north to the Hudson Bay area to inspect trapping holdings inherited from her uncle. Frederick Van Court, who frequently proposes to her, and Flora O'Hare accompany her. Lazar, the Canadian manager of the post, openly desires both the company and Ninon for himself and sets fire to the warehouse when Ninon sends him away. When Ninon, Frederick, and Lawatha catch up with Lazar, he makes advances to Ninon; Frederick defends her and is seriously hurt. Lazar and Lawatha kill each other, and Ninon and Frederick survive the difficult return journey to find a happy future.",https://www.imdb.com/title/tt0013778/,['Violet Clark'],['Tom Forman'],"['Katherine MacDonald', 'Bryant Washburn', 'Mitchell Lewis', 'June Elvidge', 'Clarissa Selwynne', 'Boris Karloff', 'Francis McDonald']",,,,,28-12-1922,['United States'],,['B.P. Schulberg Productions'],,['Drama'],"['None', 'English']"
tt0022625,Amateur Daddy,1h 11m,Passed,6.6,21,,"Jim Gladden, a construction site foreman, is partially responsible for the accidental death of one of his workers, Fred Smith, and makes good on Fred's deathbed request to go to Scotch Valley and take care of his surviving wife and children. When Jim arrives in the small town, he is told that there are two Fred Smith families in Scotch Valley, the rich Smiths and the poor Smiths. Jim assumes that the Smiths he is looking for are the poor ones, and is directed to a house where four children live in poverty. In the absence of her recently deceased mother and deserting father, Sally, the oldest child, has taken over the responsibilities of rearing the other three children. Initially, Sally mistrusts Jim's intrusion, but later realizes his good intentions and accepts his help. Wanting to find food for the children, Jim asks about their neighbors, and Pete, the oldest boy, informs Jim that one neighbor, Sam Pelgram, once beat him and later cut off their water supply. Jim, unable to believe that any man could be so cruel, goes to see Pelgram for himself and discovers that Pete's description is accurate. After failing to reason with mean-spirited Pelgram, Jim tries to reason with his wife, but soon realizes that she is only interested in seducing him. Jim seeks the legal help of William J. Hansen to begin adoption procedures and, in town, meets Olive Smith, an attractive young woman to whom he is instantly attracted. Sally soon becomes jealous of Jim and Olive's relationship and competes with Olive for his attention. Meanwhile, Pelgram organizes a group of local men to run Jim out of town by abducting and whipping him. Jim survives the ordeal and later discovers that Pelgram wants the Smith ranch because he has found oil on it. At the guardianship hearings, Mrs. Pelgram testifies against Jim's character by fabricating a story about how he made sexual advances toward her. The judge, however, is convinced of Jim's suitability as a parent and grants him custody of the children. Returning to the Smith ranch, Jim and the children are shocked to see their father, who has just been released from San Quentin. Smith announces that, just moments before, he sold the ranch to Pelgram. When Smith learns about the oil on the land, he welches on his deal with Pelgram, and Pelgram kills him. Pelgram is then arrested and led away to prison. Despite his realization that he has been living with the wrong Smith family all along, Jim decides to remain with his newly adopted family.",https://www.imdb.com/title/tt0022625/,"['Mildred Cram', 'Frank Dolan', 'Doris Malloy']",['John G. Blystone'],"['Warner Baxter', 'Marian Nixon', 'Rita La Roy', 'William Pawley', 'Lucille Powers', 'David Landau', 'Clarence Wilson', 'Frankie Darro', 'Gail Kornfeld', 'Joe Hachey']",,,,,10-04-1932,['United States'],,['Fox Film Corporation'],,"['Drama', 'Romance']",['English']
tt0016394,Stage Struck,1h 10m,,6.8,1.1K,,"A young woman dreams of becoming a great actress. When her boyfriend starts to flirt with an actual actress, she becomes jealous and decides to fight with her rival.",https://www.imdb.com/title/tt0016394/,"['Frank R. Adams', 'Forrest Halsey', 'Sylvia LaVarre']",['Allan Dwan'],"['Gloria Swanson', 'Lawrence Gray', 'Gertrude Astor', 'Oliver Sandys', 'Ford Sterling', 'Carrie Scott', 'Emil Hoch', 'Margery Whittington']",,,,"$241,507",16-11-1925,['United States'],"['Kaufman Astoria Studios - 3412 36th Street, Astoria, Queens, New York City, New York, USA (Studio)']",['Paramount Pictures'],,['Comedy'],"['None', 'English']"
tt0073011,The Four Deuces,1h 27m,R,4.1,281,,"Gangland boss Vic Morono presides over a mixed pack of cards with the trumps being the ""The Four Deuces"": Chip Morono, Mickey Navarro, Ben Arlen, and Smokey Ross.",https://www.imdb.com/title/tt0073011/,"['Don Martin', 'Lester Franklin']",['William H. Bushnell'],"['Jack Palance', 'Carol Lynley', 'Warren Berlinger', 'Adam Roarke', 'Gianni Russo', 'H.B. Haggerty', 'Johnny Haymer', 'Martin Kove', 'Cherie Latimer', 'E.J. Peaker']",,,,,28-01-1976,"['Israel', 'United States']","['Los Angeles, California, USA (Location)']",['AmeriEuro Pictures Corp'],,"['Action', 'Comedy']",['English']
tt0279117,The Great Sex War,1h 38m,,6.1,32,,"Very little is known about this movie except that it was a comedy alternatively titled ""Make Love Not War"". According to some sources, it was never released.",https://www.imdb.com/title/tt0279117/,"['Alex Gottlieb', 'Byron Haskin', 'Dirk Wayne Summers']",['Norman Foster'],"['James Franciscus', 'Joan Marshall', 'George Raft', 'Cantinflas', 'Fred H. Sills', 'Fred Otash', 'George Becwar', 'Gloria Swanson', 'Byron Webster']",,,,,01-01-1969,"['Mexico', 'United States']",['Mexico'],"['Cinema General', 'Cinerama Productions Corp.']",,['Comedy'],['English']
tt0123248,Run Chrissie Run!,1h 30m,PG,5.5,102,,"The action moves along quickly in this made-for-television drama about Eve, an ex-terrorist from Germany who is forced to escape to Australia with her teenage daughter Chrissie when she is sought by Riley, a lover from 17 years in the past. In turn, the IRA has sent two members after Riley because he shot an IRA soldier and must pay the consequences. The two IRA operatives looking for Riley come across a really nasty biker who wants vengeance on Eve for setting his car on fire -- and the three men finally track her and Chrissie to the wine-growing country of Barossa Valley. The final denouement is about to explode, as Riley also arrives on the scene. With under-par acting and a patchy plot, this film was never released theatrically.",https://www.imdb.com/title/tt0123248/,"['Graham Hartley', 'Keith Leopold']",['Chris Langman'],"['Carmen Duncan', 'Michael Aitkens', 'Shane Briant', 'Red Symons', 'Nicholas Eadie', 'Annie Jones', 'David Clencie', 'Peter Stratford', 'Glenn Boswell', 'Hans Van Gyen']","A$1,646,000 (estimated)",,,,17-05-1984,['Australia'],"['Marananga, South Australia, Australia']",['The South Australian Film Corporation'],,"['Teen Romance', 'Action', 'Adventure', 'Crime', 'Drama', 'Romance']",['English']
tt0076330,Lost in the Wild,1h 33m,,6,74,,A twelve year old boy and a common criminal are being transported in the same ship from England to Australia in the last century. When the ship wrecked they happen to be the only survivors of the catastrophe. Now they have to get along with each other and finally become friends.,https://www.imdb.com/title/tt0076330/,['Colin Drake'],['David Waddington'],"['Sean Kramer', 'Brett Maxworthy', 'Lionel Long', 'Jack Allen', 'Spike Milligan', 'Shirley Cameron', 'Jackie Rees', 'Robert Quilter', 'Rob Steele', 'Danny Adcock']",,,,,16-12-1976,"['Australia', 'United States']",,"['Columbia Pictures', 'The Australian Film Commission']",,"['Adventure', 'Western']",['English']
tt0178868,Ringu,1h 36m,Not Rated,7.2,81K,,"When her niece is found dead along with three friends after viewing a supposedly cursed videotape, reporter Reiko sets out to investigate. She finds the tape, watches it and receives a phone call informing her that she'll die in a week.",https://www.imdb.com/title/tt0178868/,"['Hiroshi Takahashi', 'Kôji Suzuki']",['Hideo Nakata'],"['Nanako Matsushima', 'Miki Nakatani', 'Yûko Takeuchi', 'Hitomi Satô', 'Yôichi Numata', 'Yutaka Matsushige', 'Katsumi Muramatsu', 'Rikiya Ôtaka', 'Masako', 'Daisuke Ban']","$1,200,000 (estimated)",,"$362,944",,31-01-1998,['Japan'],,"['Basara Pictures', 'Toho', 'Imagica']",,"['Supernatural Horror', 'Horror', 'Mystery']",['Japanese']
tt0106323,Auntie Lee's Meat Pies,1h 40m,R,5.1,1.1K,,"A devil-worshiping woman sends out her four beautiful nieces to lure men back to her place so they can be killed, ground up and sold as meat pies.",https://www.imdb.com/title/tt0106323/,"['Joseph F. Robertson', 'Gerald Stein']",['Joseph F. Robertson'],"['Karen Black', 'Pat Morita', 'Kristine Rose', 'Michael Berryman', 'Pat Paulsen', 'Huntz Hall', 'Ava Fabian', 'Richard Vidan', 'David Parry', 'Teri Weigel']",,,,,21-10-1992,['United States'],"['Fullerton, California, USA (Location)']",['Steiner Films'],,"['Parody', 'Slasher Horror', 'Comedy', 'Fantasy', 'Horror']",['English']
tt0107492,The Making of '...and God Spoke',1h 22m,R,6.6,964,,A documentary on the making of a big budget Bible picture. This is a spoof that shows the inside action on a film set where everything that could possibly go wrong goes wrong,https://www.imdb.com/title/tt0107492/,"['Arthur Borman', 'Mark Borman', 'Greg Malins']",['Arthur Borman'],"['Michael Riley', 'Stephen Rappaport', 'Tamara Mello', 'Ashlie Rhey', 'Monique Parent', 'Tori Sinclair', 'Jen Kuo Sung', 'Daniel Tisman', 'Tino Orsini', 'Jason Edwards']",,"$18,886","$58,484","$58,484",27-04-1994,['United States'],,['Brookwood Entertainment'],,"['Parody', 'Comedy']",['English']
tt0031621,"Mandrake, the Magician",3h 35m,Approved,6.3,219,,"Mandrake and his assistant Lothar are working the cruise lines and make the acquaintance of Professor Houston who has developed a radium energy machine, which is much coveted by a masked Crime Lord known as ""The Wasp"".",https://www.imdb.com/title/tt0031621/,"['Joseph F. Poland', 'Basil Dickey', 'Ned Dandy']","['Norman Deming', 'Sam Nelson']","['Warren Hull', 'Doris Weston', 'Al Kikume', 'Rex Downing', 'Edward Earle', 'Forbes Murray', 'Kenneth MacDonald', 'Don Beddoe', 'Dick Curtis', 'John Tyrrell']",,,,,06-05-1939,['United States'],,['Columbia Pictures'],,"['Superhero', 'Action', 'Adventure', 'Crime', 'Family']",['English']
tt0407828,Gobernador,1h 44m,,,,,,https://www.imdb.com/title/tt0407828/,"['Antonio B. Pascua', 'Agustin dela Cruz']",['Romy Suzara'],"['Eddie Garcia', 'Pinky De Leon', 'Dante Rivero', 'Rez Cortez', 'Lito Legaspi', 'Patrick Dela Rosa', 'Beverly Vergel', 'Bing-Bing Prieto', 'Berting Labra', 'Bomber Moran']",,,,,29-10-1992,['Philippines'],,"['Filmstar Productions', 'Stellar Film']",,['Action'],"['Filipino', 'Tagalog']"
tt0069528,Young Winston,2h 4m,PG,6.7,3.1K,,"Complex family relationships, as well as a combat experience, form the personality of the future world-known politician.",https://www.imdb.com/title/tt0069528/,"['Winston Churchill', 'Carl Foreman']",['Richard Attenborough'],"['Simon Ward', 'Robert Shaw', 'Peter Cellier', 'Ronald Hines', 'Dino Shafeek', 'John Mills', 'Anne Bancroft', 'Russell Lewis', 'Pat Heywood', 'Laurence Naismith']",,,,"$4,687,000",21-07-1972,['United Kingdom'],"['Blenheim Palace, Woodstock, Oxfordshire, England, UK']",['Open Road Films (II)'],,"['Docudrama', 'Period Drama', 'Biography', 'Drama', 'War']",['English']
tt0015338,The Sixth Commandment,1h,,6.4,16,,"John loves Marian, engaged to unfaithful Robert. Marian breaks engagement after learning of Robert's infidelity. John goes to war, returns blinded. Robert dies, John and Marian accused of murder.",https://www.imdb.com/title/tt0015338/,"['Merritt Crawford', 'Arthur Hoerl']",['Christy Cabanne'],"['William Faversham', 'Charlotte Walker', 'John Boles', 'Kathleen Martyn', 'Neil Hamilton', 'Coit Albertson', 'Sara Wood', 'Consuelo Flowerton', 'Charles Emmett Mack', 'Edmund Breese']",,,,,01-06-1924,['United States'],,['Encore Pictures'],,['Drama'],['None']
tt0085588,Getting It On,1h 36m,R,3.6,372,,"An ordinary sex-starved teenager and his friends start secretly video recording high school girls and their activity irks the community, as well as their principal.",https://www.imdb.com/title/tt0085588/,['William Olsen'],['William Olsen'],"['Martin Yost', 'Heather Kennedy', 'Jeff Edmond', 'Kathy Brickmeier', 'Mark Alan Ferri', 'C.K. Bibby', 'Terry Loughlin', 'Caroline McDonald', 'Sue Satoris', 'Kim Saunders']","$220,000 (estimated)","$975,414","$975,414","$975,414",19-08-1983,['United States'],"['North Carolina, USA']",['Seventh Avenue Films'],,['Comedy'],['English']
tt0176345,Zlaté kapradí,1h 55m,,7,166,,"Czech fairy tale about a shepherd who finds a golden fern with magical powers. He can ensure his continued happiness if he does the right thing, but will he?",https://www.imdb.com/title/tt0176345/,"['Jan Drda', 'Jirí Weiss']",['Jirí Weiss'],"['Vít Olmer', 'Daniela Smutná', 'Karla Chadimová', 'Frantisek Smolík', 'Radoslav Brzobohatý', 'Zdenek Braunschläger', 'Cestmír Randa', 'Josef Bek', 'Otomar Krejca', 'Bohumil Svarc']",,,,,22-11-1963,['Czechoslovakia'],,['Ceskoslovenský Státní Film'],,"['Fairy Tale', 'Adventure', 'Fantasy', 'Romance']",['Czech']
